{"candidate":{"artifactDigest":"sha256:3333333333333333333333333333333333333333333333333333333333333333","artifactId":"300","candidateId":"candidate-1111111111111111111111111111111111111111-200-1","manifestSha256":"sha256:4f426da5a37029965807811a881552d100a62cd0ad97a9db7bba3048efa4ebb4","workflowAttempt":1,"workflowRunId":"200"},"catalog":{"schemaVersion":1,"sha256":"sha256:b73f3d1b754f0830653890ed572e4e4a14c9e3018206e3c798564b978a115771"},"changelog":"Ajustes ficticios validados pelo pipeline.","components":[{"builtAt":"2026-07-29T12:00:00Z","checks":{"build":"passed","scan":"passed","test":"passed"},"commitSha":"1111111111111111111111111111111111111111","digest":"sha256:0000000000000000000000000000000000000000000000000000000000000001","id":"backend","imageRepository":"ghcr.io/greggorio/abaronesa-emporio-backend","immutableRef":"ghcr.io/greggorio/abaronesa-emporio-backend@sha256:0000000000000000000000000000000000000000000000000000000000000001","labels":{"org.opencontainers.image.created":"2026-07-29T12:00:00Z","org.opencontainers.image.revision":"1111111111111111111111111111111111111111","org.opencontainers.image.source":"https://github.com/greggorio/abaronesa-emporio","org.opencontainers.image.version":"candidate-1111111111111111111111111111111111111111-200-1"},"originCandidateId":null,"state":"built","tag":"ghcr.io/greggorio/abaronesa-emporio-backend:sha-1111111111111111111111111111111111111111","workflowAttempt":1,"workflowRunId":"200"},{"builtAt":"2026-07-29T12:00:00Z","checks":{"build":"passed","scan":"passed","test":"passed"},"commitSha":"1111111111111111111111111111111111111111","digest":"sha256:0000000000000000000000000000000000000000000000000000000000000002","id":"website_back","imageRepository":"ghcr.io/greggorio/abaronesa-emporio-website-backend","immutableRef":"ghcr.io/greggorio/abaronesa-emporio-website-backend@sha256:0000000000000000000000000000000000000000000000000000000000000002","labels":{"org.opencontainers.image.created":"2026-07-29T12:00:00Z","org.opencontainers.image.revision":"1111111111111111111111111111111111111111","org.opencontainers.image.source":"https://github.com/greggorio/abaronesa-emporio","org.opencontainers.image.version":"candidate-1111111111111111111111111111111111111111-200-1"},"originCandidateId":null,"state":"built","tag":"ghcr.io/greggorio/abaronesa-emporio-website-backend:sha-1111111111111111111111111111111111111111","workflowAttempt":1,"workflowRunId":"200"},{"builtAt":"2026-07-29T12:00:00Z","checks":{"build":"passed","scan":"passed","test":"passed"},"commitSha":"1111111111111111111111111111111111111111","digest":"sha256:0000000000000000000000000000000000000000000000000000000000000003","id":"frontend","imageRepository":"ghcr.io/greggorio/abaronesa-emporio-frontend","immutableRef":"ghcr.io/greggorio/abaronesa-emporio-frontend@sha256:0000000000000000000000000000000000000000000000000000000000000003","labels":{"org.opencontainers.image.created":"2026-07-29T12:00:00Z","org.opencontainers.image.revision":"1111111111111111111111111111111111111111","org.opencontainers.image.source":"https://github.com/greggorio/abaronesa-emporio","org.opencontainers.image.version":"candidate-1111111111111111111111111111111111111111-200-1"},"originCandidateId":null,"state":"built","tag":"ghcr.io/greggorio/abaronesa-emporio-frontend:sha-1111111111111111111111111111111111111111","workflowAttempt":1,"workflowRunId":"200"},{"builtAt":"2026-07-29T12:00:00Z","checks":{"build":"passed","scan":"passed","test":"passed"},"commitSha":"1111111111111111111111111111111111111111","digest":"sha256:0000000000000000000000000000000000000000000000000000000000000004","id":"website_front","imageRepository":"ghcr.io/greggorio/abaronesa-emporio-website-frontend","immutableRef":"ghcr.io/greggorio/abaronesa-emporio-website-frontend@sha256:0000000000000000000000000000000000000000000000000000000000000004","labels":{"org.opencontainers.image.created":"2026-07-29T12:00:00Z","org.opencontainers.image.revision":"1111111111111111111111111111111111111111","org.opencontainers.image.source":"https://github.com/greggorio/abaronesa-emporio","org.opencontainers.image.version":"candidate-1111111111111111111111111111111111111111-200-1"},"originCandidateId":null,"state":"built","tag":"ghcr.io/greggorio/abaronesa-emporio-website-frontend:sha-1111111111111111111111111111111111111111","workflowAttempt":1,"workflowRunId":"200"},{"builtAt":"2026-07-29T12:00:00Z","checks":{"build":"passed","scan":"passed","test":"passed"},"commitSha":"1111111111111111111111111111111111111111","digest":"sha256:0000000000000000000000000000000000000000000000000000000000000005","id":"whatsapp_service","imageRepository":"ghcr.io/greggorio/abaronesa-emporio-whatsapp-service","immutableRef":"ghcr.io/greggorio/abaronesa-emporio-whatsapp-service@sha256:0000000000000000000000000000000000000000000000000000000000000005","labels":{"org.opencontainers.image.created":"2026-07-29T12:00:00Z","org.opencontainers.image.revision":"1111111111111111111111111111111111111111","org.opencontainers.image.source":"https://github.com/greggorio/abaronesa-emporio","org.opencontainers.image.version":"candidate-1111111111111111111111111111111111111111-200-1"},"originCandidateId":null,"state":"built","tag":"ghcr.io/greggorio/abaronesa-emporio-whatsapp-service:sha-1111111111111111111111111111111111111111","workflowAttempt":1,"workflowRunId":"200"},{"builtAt":"2026-07-29T12:00:00Z","checks":{"build":"passed","scan":"passed","test":"passed"},"commitSha":"1111111111111111111111111111111111111111","digest":"sha256:0000000000000000000000000000000000000000000000000000000000000006","id":"gateway","imageRepository":"ghcr.io/greggorio/abaronesa-emporio-gateway","immutableRef":"ghcr.io/greggorio/abaronesa-emporio-gateway@sha256:0000000000000000000000000000000000000000000000000000000000000006","labels":{"org.opencontainers.image.created":"2026-07-29T12:00:00Z","org.opencontainers.image.revision":"1111111111111111111111111111111111111111","org.opencontainers.image.source":"https://github.com/greggorio/abaronesa-emporio","org.opencontainers.image.version":"candidate-1111111111111111111111111111111111111111-200-1"},"originCandidateId":null,"state":"built","tag":"ghcr.io/greggorio/abaronesa-emporio-gateway:sha-1111111111111111111111111111111111111111","workflowAttempt":1,"workflowRunId":"200"}],"databases":[{"backupPolicy":"required_on_change","engine":"flyway","id":"erp","latestVersion":"20260802120000","location":"backend/src/main/resources/db/migration","migrationSetSha256":"sha256:156e6049bff42c10b187d5f269a68fc57562b5716c8ea0266b0891008acff5eb","migrations":[{"path":"backend/src/main/resources/db/migration/V1__init.sql","sha256":"sha256:d77a9755ee412a891e7f8651129a9ebf4d5fdfd86a8f42ad68529a9a58d6f800","version":"1"},{"path":"backend/src/main/resources/db/migration/V2__dynamic_form_definitions.sql","sha256":"sha256:dd69bf3489cb11f2c848da1eb6ef7f1f156b0673a253c20b2c0316d7c8615758","version":"2"},{"path":"backend/src/main/resources/db/migration/V3__add_referencia_to_mesa.sql","sha256":"sha256:fcb94f1a3fd5fc696e85b6c64ddabba2bf22035ff10517719dfa52d006339d4c","version":"3"},{"path":"backend/src/main/resources/db/migration/V4__extend_referencia_to_mesa.sql","sha256":"sha256:49d0f165021ec990cedb0cdc22c55a983a7422b63d056f5e46672b31053ee3ef","version":"4"},{"path":"backend/src/main/resources/db/migration/V5__add_producao_propria_to_produto.sql","sha256":"sha256:671f0880eeec415980c9e4d4b18cbb42f396fd331a0598d3b82e1e1bc03626e3","version":"5"},{"path":"backend/src/main/resources/db/migration/V6__add_producao_propria_to_form.sql","sha256":"sha256:b47ca613726b8017e01b3417f13af40cb00c447c1772ca82165f5d1d07039e58","version":"6"},{"path":"backend/src/main/resources/db/migration/V20251223100000__create_sessao_cobrancas_table.sql","sha256":"sha256:3cd22b73e6037e3ad0ea7e6ede58ad584b0fb0714f82dc403b5641fad9038a8f","version":"20251223100000"},{"path":"backend/src/main/resources/db/migration/V20251224000000__add_valor_couvert_to_pagamento.sql","sha256":"sha256:a414b58dbb735c109ad9efbd7bec5e237575b994a55a9c733fb6b95c8205be87","version":"20251224000000"},{"path":"backend/src/main/resources/db/migration/V20251225000000__create_birthday_notification_log_table.sql","sha256":"sha256:1df1cb9863436e95d5b035c6938dbddfa34853ed544a34d51708fb5a45b27b60","version":"20251225000000"},{"path":"backend/src/main/resources/db/migration/V20251225001000__create_job_tables.sql","sha256":"sha256:26a76753f8c426df2e01acb320a09bca8cae0fb23b19ec1aa6f20b55a2c7af47","version":"20251225001000"},{"path":"backend/src/main/resources/db/migration/V20251225002000__create_event_notification_log_table.sql","sha256":"sha256:638a2de3c998eac413bb19b7db643561b2f292de2ffbcad67f0669d27cfff621","version":"20251225002000"},{"path":"backend/src/main/resources/db/migration/V20251228090000__create_delivery_order_tables.sql","sha256":"sha256:ff5a100d847b438f5b833e576d2d1eac8849ecf3d9808ebb1f9e963b90ffe8c8","version":"20251228090000"},{"path":"backend/src/main/resources/db/migration/V20251228090500__alter_delivery_order_raw_response_to_text.sql","sha256":"sha256:71ec08174fc652af78c151c057593388d5e63494958ea96fbc63b6d130003c2f","version":"20251228090500"},{"path":"backend/src/main/resources/db/migration/V20251228160000__add_uber_fields_to_delivery_order.sql","sha256":"sha256:991676b3330256ee741a51b87e663417edd2237a2c95a0151e71c336184efcc5","version":"20251228160000"},{"path":"backend/src/main/resources/db/migration/V20251228170000__add_kds_published_at_to_delivery_order.sql","sha256":"sha256:020b0b552a668f3c1f9b623515f090feca42d9bdab64c2800b2a71742ebd5fde","version":"20251228170000"},{"path":"backend/src/main/resources/db/migration/V20251228180000__create_payment_table.sql","sha256":"sha256:6beb89721974d914a754d0b666a6a213c397342a267ec702ac59ce38716a9533","version":"20251228180000"},{"path":"backend/src/main/resources/db/migration/V20251228180500__add_delivery_kds_archive.sql","sha256":"sha256:cda1f5e686f1926b558f6621b67fdd66ca32ae1f9fd085c77919aedfdb502dd1","version":"202